{
  "event_id": "evt_synthetic_p1_007",
  "event_type": "EVT-P1-007",
  "schema_version": "1.0.0",
  "occurred_at": "2026-08-26T02:01:00Z",
  "recorded_at": "2026-08-26T02:01:01Z",
  "scope_kind": "WORKSPACE",
  "workspace_id": "workspace_synthetic_001",
  "aggregate_type": "ArtifactRecord",
  "aggregate_id": "artifact_synthetic_001",
  "aggregate_revision": 2,
  "aggregate_event_index": 0,
  "attempt": 1,
  "producer": {
    "producer_id": "service.intake.synthetic",
    "operation": "CHANGE_ARTIFACT_INTEGRITY_STATE"
  },
  "actor": {
    "actor_id": "service.intake.synthetic",
    "actor_class": "SERVICE"
  },
  "authorization": {
    "decision_ref": "authz_synthetic_007",
    "decision": "ALLOW",
    "policy_version": "policy.synthetic.v1",
    "authorization_epoch": "auth_epoch_004"
  },
  "correlation_id": "correlation_synthetic_007",
  "causation_id": "scan_synthetic_001",
  "idempotency_key": "idempotency_synthetic_007",
  "classification": {
    "data_class": "P3-SENSITIVE",
    "purpose_id": "PUR-P1-002",
    "residency_policy_ref": "residency.unresolved.DEC-040",
    "retention_rule_ref": "retention.unresolved.DEC-039",
    "deletion_lineage_ref": "deletion.lineage.synthetic.v1"
  },
  "deletion_fence": {
    "state": "NOT_FENCED",
    "generation": 0
  },
  "payload": {
    "integrity_state": "Verified",
    "quarantine_state": "Contained",
    "safety_assessment_id": "safety_assessment_synthetic_001",
    "content_digest_ref": "digest_ref_synthetic_001",
    "reason_code": "POLICY_HOLD_PRESERVED"
  }
}
