{
  "event_id": "evt_synthetic_p1_021",
  "event_type": "EVT-P1-021",
  "schema_version": "1.0.0",
  "occurred_at": "2026-08-26T05:01:00Z",
  "recorded_at": "2026-08-26T05:01:01Z",
  "scope_kind": "WORKSPACE",
  "workspace_id": "workspace_synthetic_001",
  "aggregate_type": "Recommendation",
  "aggregate_id": "recommendation_synthetic_001",
  "aggregate_revision": 2,
  "aggregate_event_index": 0,
  "attempt": 1,
  "producer": {
    "producer_id": "service.recommendation.synthetic",
    "operation": "CHANGE_RECOMMENDATION_STATE"
  },
  "actor": {
    "actor_id": "actor_synthetic_001",
    "actor_class": "HUMAN"
  },
  "authorization": {
    "decision_ref": "authz_synthetic_021",
    "decision": "ALLOW",
    "policy_version": "policy.synthetic.v1",
    "authorization_epoch": "auth_epoch_004"
  },
  "correlation_id": "correlation_synthetic_021",
  "causation_id": "impact_assessment_synthetic_001",
  "idempotency_key": "idempotency_synthetic_021",
  "classification": {
    "data_class": "P3-SENSITIVE",
    "purpose_id": "PUR-P1-004",
    "residency_policy_ref": "residency.unresolved.DEC-040",
    "retention_rule_ref": "retention.unresolved.DEC-039",
    "deletion_lineage_ref": "deletion.lineage.synthetic.v1"
  },
  "deletion_fence": {
    "state": "NOT_FENCED",
    "generation": 0
  },
  "payload": {
    "impact_assessment_id": "impact_assessment_synthetic_001",
    "from_state": "Proposed",
    "to_state": "Deferred",
    "recommendation_decision": "DEFER",
    "evidence_bundle_ref": "evidence_bundle_synthetic_021",
    "proposed_effect_digest_ref": null,
    "reason_code": "MORE_EVIDENCE_REQUIRED"
  }
}
