{
  "event_id": "evt_synthetic_p1_020",
  "event_type": "EVT-P1-020",
  "schema_version": "1.0.0",
  "occurred_at": "2026-08-26T05:00:00Z",
  "recorded_at": "2026-08-26T05:00:01Z",
  "scope_kind": "WORKSPACE",
  "workspace_id": "workspace_synthetic_001",
  "aggregate_type": "ImpactAssessment",
  "aggregate_id": "impact_assessment_synthetic_001",
  "aggregate_revision": 1,
  "aggregate_event_index": 0,
  "attempt": 1,
  "producer": {
    "producer_id": "service.impact.synthetic",
    "operation": "RECORD_IMPACT_ASSESSMENT"
  },
  "actor": {
    "actor_id": "service.impact.synthetic",
    "actor_class": "SERVICE"
  },
  "authorization": {
    "decision_ref": "authz_synthetic_020",
    "decision": "ALLOW",
    "policy_version": "policy.synthetic.v1",
    "authorization_epoch": "auth_epoch_004"
  },
  "correlation_id": "correlation_synthetic_020",
  "causation_id": "change_case_synthetic_001",
  "idempotency_key": "idempotency_synthetic_020",
  "classification": {
    "data_class": "P3-SENSITIVE",
    "purpose_id": "PUR-P1-004",
    "residency_policy_ref": "residency.unresolved.DEC-040",
    "retention_rule_ref": "retention.unresolved.DEC-039",
    "deletion_lineage_ref": "deletion.lineage.synthetic.v1"
  },
  "deletion_fence": {
    "state": "NOT_FENCED",
    "generation": 0
  },
  "payload": {
    "change_case_id": "change_case_synthetic_001",
    "assessment_generation_id": "impact_generation_synthetic_001",
    "applicability_outcome": "REVIEW_REQUIRED",
    "primary_class": "REVIEW_REQUIRED",
    "separated_dimensions_ref": "impact_dimensions_synthetic_020",
    "impact_path_refs": [
      "impact_path_synthetic_001"
    ],
    "coverage_state": "CompleteWithinDeclaredScope",
    "review_state": "ReviewRequired"
  }
}
