{
  "event_id": "evt_synthetic_p1_009",
  "event_type": "EVT-P1-009",
  "schema_version": "1.0.0",
  "occurred_at": "2026-08-26T02:03:00Z",
  "recorded_at": "2026-08-26T02:03:01Z",
  "scope_kind": "WORKSPACE",
  "workspace_id": "workspace_synthetic_001",
  "aggregate_type": "LogicalDocument",
  "aggregate_id": "logical_document_synthetic_001",
  "aggregate_revision": 2,
  "aggregate_event_index": 0,
  "attempt": 1,
  "producer": {
    "producer_id": "service.document.synthetic",
    "operation": "ADD_DOCUMENT_VERSION"
  },
  "actor": {
    "actor_id": "actor_synthetic_001",
    "actor_class": "HUMAN"
  },
  "authorization": {
    "decision_ref": "authz_synthetic_009",
    "decision": "ALLOW",
    "policy_version": "policy.synthetic.v1",
    "authorization_epoch": "auth_epoch_004"
  },
  "correlation_id": "correlation_synthetic_009",
  "causation_id": "command_synthetic_009",
  "idempotency_key": "idempotency_synthetic_009",
  "classification": {
    "data_class": "P3-SENSITIVE",
    "purpose_id": "PUR-P1-001",
    "residency_policy_ref": "residency.unresolved.DEC-040",
    "retention_rule_ref": "retention.unresolved.DEC-039",
    "deletion_lineage_ref": "deletion.lineage.synthetic.v1"
  },
  "deletion_fence": {
    "state": "NOT_FENCED",
    "generation": 0
  },
  "payload": {
    "document_version_id": "document_version_synthetic_001",
    "artifact_id": "artifact_synthetic_001",
    "version_sequence": 1,
    "link_decision_id": "link_decision_synthetic_001",
    "link_state": "Accepted",
    "active_analysis_generation_id": null
  }
}
