{
  "event_id": "evt_synthetic_p1_028",
  "event_type": "EVT-P1-028",
  "schema_version": "1.0.0",
  "occurred_at": "2026-08-26T06:02:00Z",
  "recorded_at": "2026-08-26T06:02:01Z",
  "scope_kind": "WORKSPACE",
  "workspace_id": "workspace_synthetic_001",
  "aggregate_type": "DeletionCase",
  "aggregate_id": "deletion_case_synthetic_001",
  "aggregate_revision": 2,
  "aggregate_event_index": 0,
  "attempt": 1,
  "producer": {
    "producer_id": "service.deletion.synthetic",
    "operation": "CHANGE_DELETION_CASE_STATE"
  },
  "actor": {
    "actor_id": "service.deletion.synthetic",
    "actor_class": "SERVICE"
  },
  "authorization": {
    "decision_ref": "authz_synthetic_028",
    "decision": "ALLOW",
    "policy_version": "policy.synthetic.v1",
    "authorization_epoch": "auth_epoch_004"
  },
  "correlation_id": "correlation_synthetic_028",
  "causation_id": "deletion_command_synthetic_001",
  "idempotency_key": "idempotency_synthetic_028",
  "classification": {
    "data_class": "P3-SENSITIVE",
    "purpose_id": "PUR-P1-001",
    "residency_policy_ref": "residency.unresolved.DEC-040",
    "retention_rule_ref": "retention.unresolved.DEC-039",
    "deletion_lineage_ref": "deletion.lineage.synthetic.v1"
  },
  "deletion_fence": {
    "state": "FENCED",
    "generation": 1,
    "deletion_case_id": "deletion_case_synthetic_001"
  },
  "payload": {
    "deletion_scope_ref": "deletion_scope_synthetic_001",
    "from_state": "DeletionRequested",
    "to_state": "Fenced",
    "fence_generation": 1,
    "deletion_plan_ref": "deletion_plan_synthetic_001",
    "residual_state": "PendingEvaluation",
    "reason_code": "FENCE_ACTIVATED"
  }
}
