{
  "event_id": "evt_synthetic_p1_001",
  "event_type": "EVT-P1-001",
  "schema_version": "1.0.0",
  "occurred_at": "2026-08-26T01:00:00Z",
  "recorded_at": "2026-08-26T01:00:01Z",
  "scope_kind": "WORKSPACE",
  "workspace_id": "workspace_synthetic_001",
  "aggregate_type": "Workspace",
  "aggregate_id": "workspace_synthetic_001",
  "aggregate_revision": 1,
  "aggregate_event_index": 0,
  "attempt": 1,
  "producer": {
    "producer_id": "service.workspace.synthetic",
    "operation": "CHANGE_WORKSPACE_STATE"
  },
  "actor": {
    "actor_id": "actor_synthetic_001",
    "actor_class": "HUMAN"
  },
  "authorization": {
    "decision_ref": "authz_synthetic_001",
    "decision": "ALLOW",
    "policy_version": "policy.synthetic.v1",
    "authorization_epoch": "auth_epoch_001"
  },
  "correlation_id": "correlation_synthetic_001",
  "causation_id": "command_synthetic_001",
  "idempotency_key": "idempotency_synthetic_001",
  "classification": {
    "data_class": "P2-HOUSEHOLD",
    "purpose_id": "PUR-P1-001",
    "residency_policy_ref": "residency.unresolved.DEC-040",
    "retention_rule_ref": "retention.unresolved.DEC-039",
    "deletion_lineage_ref": "deletion.lineage.synthetic.v1"
  },
  "deletion_fence": {
    "state": "NOT_FENCED",
    "generation": 0
  },
  "payload": {
    "transition_id": "transition_synthetic_001",
    "from_state": null,
    "to_state": "Active",
    "reason_code": "WORKSPACE_CREATED",
    "configuration_package_ref": "configuration.synthetic.disabled.v1"
  }
}
