{
  "event_id": "evt_synthetic_p1_022",
  "event_type": "EVT-P1-022",
  "schema_version": "1.0.0",
  "occurred_at": "2026-08-26T05:02:00Z",
  "recorded_at": "2026-08-26T05:02:01Z",
  "scope_kind": "WORKSPACE",
  "workspace_id": "workspace_synthetic_001",
  "aggregate_type": "Approval",
  "aggregate_id": "approval_synthetic_001",
  "aggregate_revision": 2,
  "aggregate_event_index": 0,
  "attempt": 1,
  "producer": {
    "producer_id": "service.approval.synthetic",
    "operation": "CHANGE_APPROVAL_STATE"
  },
  "actor": {
    "actor_id": "actor_synthetic_002",
    "actor_class": "HUMAN"
  },
  "authorization": {
    "decision_ref": "authz_synthetic_022",
    "decision": "ALLOW",
    "policy_version": "policy.synthetic.v1",
    "authorization_epoch": "auth_epoch_004"
  },
  "correlation_id": "correlation_synthetic_022",
  "causation_id": "approval_command_synthetic_001",
  "idempotency_key": "idempotency_synthetic_022",
  "classification": {
    "data_class": "P3-SENSITIVE",
    "purpose_id": "PUR-P1-001",
    "residency_policy_ref": "residency.unresolved.DEC-040",
    "retention_rule_ref": "retention.unresolved.DEC-039",
    "deletion_lineage_ref": "deletion.lineage.synthetic.v1"
  },
  "deletion_fence": {
    "state": "NOT_FENCED",
    "generation": 0
  },
  "payload": {
    "from_state": "ReviewPending",
    "to_state": "Approved",
    "approval_decision": "Approved",
    "reviewed_input_digest_ref": "reviewed_input_digest_synthetic_022",
    "effect_digest_ref": "effect_digest_synthetic_022",
    "target_resource_ref": "recommendation_synthetic_002",
    "target_revision": 3,
    "reason_code": "BOUND_EFFECT_APPROVED"
  }
}
