{
  "event_id": "evt_synthetic_p1_026",
  "event_type": "EVT-P1-026",
  "schema_version": "1.0.0",
  "occurred_at": "2026-08-26T06:00:00Z",
  "recorded_at": "2026-08-26T06:00:01Z",
  "scope_kind": "WORKSPACE",
  "workspace_id": "workspace_synthetic_001",
  "aggregate_type": "Task",
  "aggregate_id": "task_synthetic_001",
  "aggregate_revision": 2,
  "aggregate_event_index": 0,
  "attempt": 1,
  "producer": {
    "producer_id": "service.task.synthetic",
    "operation": "CHANGE_TASK_STATE"
  },
  "actor": {
    "actor_id": "actor_synthetic_001",
    "actor_class": "HUMAN"
  },
  "authorization": {
    "decision_ref": "authz_synthetic_026",
    "decision": "ALLOW",
    "policy_version": "policy.synthetic.v1",
    "authorization_epoch": "auth_epoch_004"
  },
  "correlation_id": "correlation_synthetic_026",
  "causation_id": "requirement_case_synthetic_001",
  "idempotency_key": "idempotency_synthetic_026",
  "classification": {
    "data_class": "P2-HOUSEHOLD",
    "purpose_id": "PUR-P1-005",
    "residency_policy_ref": "residency.unresolved.DEC-040",
    "retention_rule_ref": "retention.unresolved.DEC-039",
    "deletion_lineage_ref": "deletion.lineage.synthetic.v1"
  },
  "deletion_fence": {
    "state": "NOT_FENCED",
    "generation": 0
  },
  "payload": {
    "causal_resource_ref": "requirement_case_synthetic_001",
    "from_state": "Open",
    "to_state": "Deferred",
    "assignee_ref": "membership_synthetic_001",
    "due_policy_ref": "due_policy.synthetic.unset",
    "evidence_requirement_ref": "criterion.synthetic.v1",
    "reminder_state": "Recorded",
    "reason_code": "REMINDER_SET"
  }
}
