{
  "event_id": "evt_synthetic_p1_012",
  "event_type": "EVT-P1-012",
  "schema_version": "1.0.0",
  "occurred_at": "2026-08-26T03:00:00Z",
  "recorded_at": "2026-08-26T03:00:01Z",
  "scope_kind": "WORKSPACE",
  "workspace_id": "workspace_synthetic_001",
  "aggregate_type": "CanonicalFact",
  "aggregate_id": "fact_synthetic_001",
  "aggregate_revision": 1,
  "aggregate_event_index": 0,
  "attempt": 1,
  "producer": {
    "producer_id": "service.fact.synthetic",
    "operation": "RECORD_FACT_OCCURRENCE"
  },
  "actor": {
    "actor_id": "service.fact.synthetic",
    "actor_class": "SERVICE"
  },
  "authorization": {
    "decision_ref": "authz_synthetic_012",
    "decision": "ALLOW",
    "policy_version": "policy.synthetic.v1",
    "authorization_epoch": "auth_epoch_004"
  },
  "correlation_id": "correlation_synthetic_012",
  "causation_id": "analysis_generation_synthetic_001",
  "idempotency_key": "idempotency_synthetic_012",
  "classification": {
    "data_class": "P3-SENSITIVE",
    "purpose_id": "PUR-P1-003",
    "residency_policy_ref": "residency.unresolved.DEC-040",
    "retention_rule_ref": "retention.unresolved.DEC-039",
    "deletion_lineage_ref": "deletion.lineage.synthetic.v1"
  },
  "deletion_fence": {
    "state": "NOT_FENCED",
    "generation": 0
  },
  "payload": {
    "fact_occurrence_id": "fact_occurrence_synthetic_001",
    "fact_definition_version": "fact.definition.synthetic.v1",
    "subject_or_entity_ref": "subject_synthetic_001",
    "source_kind": "DocumentEvidence",
    "evidence_anchor_refs": [
      "anchor_synthetic_012"
    ],
    "asserted_valid_time_ref": "valid_time_synthetic_012",
    "review_state": "ReviewRequired"
  }
}
