{
  "event_id": "evt_synthetic_p1_002",
  "event_type": "EVT-P1-002",
  "schema_version": "1.0.0",
  "occurred_at": "2026-08-26T01:01:00Z",
  "recorded_at": "2026-08-26T01:01:01Z",
  "scope_kind": "WORKSPACE",
  "workspace_id": "workspace_synthetic_001",
  "aggregate_type": "Workspace",
  "aggregate_id": "workspace_synthetic_001",
  "aggregate_revision": 2,
  "aggregate_event_index": 0,
  "attempt": 1,
  "producer": {
    "producer_id": "service.workspace.synthetic",
    "operation": "CHANGE_MEMBERSHIP_STATE"
  },
  "actor": {
    "actor_id": "actor_synthetic_001",
    "actor_class": "HUMAN"
  },
  "authorization": {
    "decision_ref": "authz_synthetic_002",
    "decision": "ALLOW",
    "policy_version": "policy.synthetic.v1",
    "authorization_epoch": "auth_epoch_002"
  },
  "correlation_id": "correlation_synthetic_002",
  "causation_id": "command_synthetic_002",
  "idempotency_key": "idempotency_synthetic_002",
  "classification": {
    "data_class": "P3-SENSITIVE",
    "purpose_id": "PUR-P1-001",
    "residency_policy_ref": "residency.unresolved.DEC-040",
    "retention_rule_ref": "retention.unresolved.DEC-039",
    "deletion_lineage_ref": "deletion.lineage.synthetic.v1"
  },
  "deletion_fence": {
    "state": "NOT_FENCED",
    "generation": 0
  },
  "payload": {
    "membership_id": "membership_synthetic_001",
    "subject_id": "subject_synthetic_001",
    "from_state": "Invited",
    "to_state": "Active",
    "reason_code": "MEMBERSHIP_ACCEPTED",
    "effective_authorization_epoch": "auth_epoch_002"
  }
}
