{
  "event_id": "evt_synthetic_p1_005",
  "event_type": "EVT-P1-005",
  "schema_version": "1.0.0",
  "occurred_at": "2026-08-26T01:04:00Z",
  "recorded_at": "2026-08-26T01:04:01Z",
  "scope_kind": "WORKSPACE",
  "workspace_id": "workspace_synthetic_001",
  "aggregate_type": "Workspace",
  "aggregate_id": "workspace_synthetic_001",
  "aggregate_revision": 4,
  "aggregate_event_index": 0,
  "attempt": 1,
  "producer": {
    "producer_id": "service.authorization.synthetic",
    "operation": "ADVANCE_AUTHORIZATION_EPOCH"
  },
  "actor": {
    "actor_id": "service.authorization.synthetic",
    "actor_class": "SERVICE"
  },
  "authorization": {
    "decision_ref": "authz_synthetic_005",
    "decision": "ALLOW",
    "policy_version": "policy.synthetic.v1",
    "authorization_epoch": "auth_epoch_004"
  },
  "correlation_id": "correlation_synthetic_005",
  "causation_id": "grant_synthetic_001",
  "idempotency_key": "idempotency_synthetic_005",
  "classification": {
    "data_class": "P2-HOUSEHOLD",
    "purpose_id": "PUR-P1-002",
    "residency_policy_ref": "residency.unresolved.DEC-040",
    "retention_rule_ref": "retention.unresolved.DEC-039",
    "deletion_lineage_ref": "deletion.lineage.synthetic.v1"
  },
  "deletion_fence": {
    "state": "NOT_FENCED",
    "generation": 0
  },
  "payload": {
    "previous_authorization_epoch": "auth_epoch_003",
    "authorization_epoch": "auth_epoch_004",
    "invalidation_reason_code": "GRANT_STATE_CHANGED",
    "affected_scope_class": "WorkspaceResources"
  }
}
