{
  "event_id": "evt_synthetic_p1_017",
  "event_type": "EVT-P1-017",
  "schema_version": "1.0.0",
  "occurred_at": "2026-08-26T04:02:00Z",
  "recorded_at": "2026-08-26T04:02:01Z",
  "scope_kind": "WORKSPACE",
  "workspace_id": "workspace_synthetic_001",
  "aggregate_type": "MonitoringRun",
  "aggregate_id": "monitoring_run_synthetic_001",
  "aggregate_revision": 1,
  "aggregate_event_index": 0,
  "attempt": 1,
  "producer": {
    "producer_id": "service.monitoring.synthetic",
    "operation": "COMPLETE_MONITORING_RUN"
  },
  "actor": {
    "actor_id": "service.monitoring.synthetic",
    "actor_class": "SERVICE"
  },
  "authorization": {
    "decision_ref": "authz_synthetic_017",
    "decision": "ALLOW",
    "policy_version": "policy.synthetic.v1",
    "authorization_epoch": "auth_epoch_004"
  },
  "correlation_id": "correlation_synthetic_017",
  "causation_id": "trigger_occurrence_synthetic_001",
  "idempotency_key": "idempotency_synthetic_017",
  "classification": {
    "data_class": "P2-HOUSEHOLD",
    "purpose_id": "PUR-P1-004",
    "residency_policy_ref": "residency.unresolved.DEC-040",
    "retention_rule_ref": "retention.unresolved.DEC-039",
    "deletion_lineage_ref": "deletion.lineage.synthetic.v1"
  },
  "deletion_fence": {
    "state": "NOT_FENCED",
    "generation": 0
  },
  "payload": {
    "monitoring_subscription_id": "monitoring_subscription_synthetic_001",
    "monitoring_rule_version": "monitoring.rule.synthetic.v1",
    "trigger_occurrence_id": "trigger_occurrence_synthetic_001",
    "input_watermark_ref": "watermark_synthetic_017",
    "run_outcome": "Completed",
    "replay_generation": 0,
    "change_case_refs": [
      "change_case_synthetic_001"
    ],
    "failure_reason_code": null
  }
}
